{
  "schemaVersion": 1,
  "corpusVersion": "1.0.0",
  "status": "frozen",
  "expectedStatus": "insufficientCoverage",
  "frozenSupportedIntents": [
    "web-application-delivery",
    "api-backend-delivery",
    "test-qa-automation",
    "security-review-hardening",
    "deployment-devops",
    "agent-mcp-development"
  ],
  "reasonCodeRegistry": "reason-codes.v1.json",
  "families": [
    "creative-content",
    "media-production",
    "personal-planning",
    "professional-advice",
    "physical-systems",
    "non-web-software"
  ],
  "cases": [
    {
      "caseId": "abstention.creative-content.historical-novella",
      "family": "creative-content",
      "inputPath": "cases/creative-content/historical-novella.json",
      "labelPath": "labels/creative-content/historical-novella.json",
      "taskFamilyFingerprint": "sha256:136ffbf95118af69f66f86d583b84135e54382c265b43c1826c25a7c6bb15a78",
      "provenance": {
        "source": "AAS v1 independent OOD corpus authoring",
        "version": "1.0.0",
        "reviewedAt": "2026-07-17"
      },
      "reviewStatus": "approved"
    },
    {
      "caseId": "abstention.creative-content.wedding-speech",
      "family": "creative-content",
      "inputPath": "cases/creative-content/wedding-speech.json",
      "labelPath": "labels/creative-content/wedding-speech.json",
      "taskFamilyFingerprint": "sha256:c178cd053e8e6ed043e6a1c42006efcd0088f0ae166713084796ef1dbce978a4",
      "provenance": {
        "source": "AAS v1 independent OOD corpus authoring",
        "version": "1.0.0",
        "reviewedAt": "2026-07-17"
      },
      "reviewStatus": "approved"
    },
    {
      "caseId": "abstention.creative-content.bilingual-poetry-edit",
      "family": "creative-content",
      "inputPath": "cases/creative-content/bilingual-poetry-edit.json",
      "labelPath": "labels/creative-content/bilingual-poetry-edit.json",
      "taskFamilyFingerprint": "sha256:d6cddac076c5e4439d35a65f89d14d1219da184fc7b8622942119a1541031ca0",
      "provenance": {
        "source": "AAS v1 independent OOD corpus authoring",
        "version": "1.0.0",
        "reviewedAt": "2026-07-17"
      },
      "reviewStatus": "approved"
    },
    {
      "caseId": "abstention.creative-content.childrens-story",
      "family": "creative-content",
      "inputPath": "cases/creative-content/childrens-story.json",
      "labelPath": "labels/creative-content/childrens-story.json",
      "taskFamilyFingerprint": "sha256:469b3ea48364dc670ae92f3205c32d9a0d07cbda4b18b0aec13b3459c61e94ae",
      "provenance": {
        "source": "AAS v1 independent OOD corpus authoring",
        "version": "1.0.0",
        "reviewedAt": "2026-07-17"
      },
      "reviewStatus": "approved"
    },
    {
      "caseId": "abstention.creative-content.magazine-narrative",
      "family": "creative-content",
      "inputPath": "cases/creative-content/magazine-narrative.json",
      "labelPath": "labels/creative-content/magazine-narrative.json",
      "taskFamilyFingerprint": "sha256:3aed13f7af126aa79162d29362d7b9d6819c9e1eb3b051b89d451fc1d2958eb8",
      "provenance": {
        "source": "AAS v1 independent OOD corpus authoring",
        "version": "1.0.0",
        "reviewedAt": "2026-07-17"
      },
      "reviewStatus": "approved"
    },
    {
      "caseId": "abstention.media-production.documentary-storyboard",
      "family": "media-production",
      "inputPath": "cases/media-production/documentary-storyboard.json",
      "labelPath": "labels/media-production/documentary-storyboard.json",
      "taskFamilyFingerprint": "sha256:8a5e1bf7296caf40a4252a3e5e85a277c409b7f98c8d06898a6617710535c790",
      "provenance": {
        "source": "AAS v1 independent OOD corpus authoring",
        "version": "1.0.0",
        "reviewedAt": "2026-07-17"
      },
      "reviewStatus": "approved"
    },
    {
      "caseId": "abstention.media-production.podcast-mastering",
      "family": "media-production",
      "inputPath": "cases/media-production/podcast-mastering.json",
      "labelPath": "labels/media-production/podcast-mastering.json",
      "taskFamilyFingerprint": "sha256:69ee04ecb0b72334095cfe121865dd523d249325ef48e34f7b2579df5d72422e",
      "provenance": {
        "source": "AAS v1 independent OOD corpus authoring",
        "version": "1.0.0",
        "reviewedAt": "2026-07-17"
      },
      "reviewStatus": "approved"
    },
    {
      "caseId": "abstention.media-production.photo-color-grade",
      "family": "media-production",
      "inputPath": "cases/media-production/photo-color-grade.json",
      "labelPath": "labels/media-production/photo-color-grade.json",
      "taskFamilyFingerprint": "sha256:c45212bf2252d79b44176778784e7712d903161c2a7b19de6fc0c75362ee9116",
      "provenance": {
        "source": "AAS v1 independent OOD corpus authoring",
        "version": "1.0.0",
        "reviewedAt": "2026-07-17"
      },
      "reviewStatus": "approved"
    },
    {
      "caseId": "abstention.media-production.string-arrangement",
      "family": "media-production",
      "inputPath": "cases/media-production/string-arrangement.json",
      "labelPath": "labels/media-production/string-arrangement.json",
      "taskFamilyFingerprint": "sha256:53ae440bce016a343fcf7fb92e8d96f368bcc0c50cb8f21cf76ad0f4012eedcd",
      "provenance": {
        "source": "AAS v1 independent OOD corpus authoring",
        "version": "1.0.0",
        "reviewedAt": "2026-07-17"
      },
      "reviewStatus": "approved"
    },
    {
      "caseId": "abstention.media-production.product-animation",
      "family": "media-production",
      "inputPath": "cases/media-production/product-animation.json",
      "labelPath": "labels/media-production/product-animation.json",
      "taskFamilyFingerprint": "sha256:78430aca14020345a8b5b0f499430f28340fd455f8dabf53c4bb443e98ba3cd1",
      "provenance": {
        "source": "AAS v1 independent OOD corpus authoring",
        "version": "1.0.0",
        "reviewedAt": "2026-07-17"
      },
      "reviewStatus": "approved"
    },
    {
      "caseId": "abstention.personal-planning.japan-itinerary",
      "family": "personal-planning",
      "inputPath": "cases/personal-planning/japan-itinerary.json",
      "labelPath": "labels/personal-planning/japan-itinerary.json",
      "taskFamilyFingerprint": "sha256:f721e32e3a52f25db5e3ad7922ee3dab18ca5d184f66556f2a251be807a86f7f",
      "provenance": {
        "source": "AAS v1 independent OOD corpus authoring",
        "version": "1.0.0",
        "reviewedAt": "2026-07-17"
      },
      "reviewStatus": "approved"
    },
    {
      "caseId": "abstention.personal-planning.vegetarian-meals",
      "family": "personal-planning",
      "inputPath": "cases/personal-planning/vegetarian-meals.json",
      "labelPath": "labels/personal-planning/vegetarian-meals.json",
      "taskFamilyFingerprint": "sha256:83384e36533327b9d1ed8fd06ca367b9481029483f4f46c376b104f71e6d5693",
      "provenance": {
        "source": "AAS v1 independent OOD corpus authoring",
        "version": "1.0.0",
        "reviewedAt": "2026-07-17"
      },
      "reviewStatus": "approved"
    },
    {
      "caseId": "abstention.personal-planning.apartment-declutter",
      "family": "personal-planning",
      "inputPath": "cases/personal-planning/apartment-declutter.json",
      "labelPath": "labels/personal-planning/apartment-declutter.json",
      "taskFamilyFingerprint": "sha256:53985391ce885bb3a03722ec7e70a5ddc2eb246a5b7dc1f82cd212b7dd8982fe",
      "provenance": {
        "source": "AAS v1 independent OOD corpus authoring",
        "version": "1.0.0",
        "reviewedAt": "2026-07-17"
      },
      "reviewStatus": "approved"
    },
    {
      "caseId": "abstention.personal-planning.wedding-seating",
      "family": "personal-planning",
      "inputPath": "cases/personal-planning/wedding-seating.json",
      "labelPath": "labels/personal-planning/wedding-seating.json",
      "taskFamilyFingerprint": "sha256:cd821960ef560f36d8dd23637c983d655115ae28ce9b6c2732a341c60058a7ca",
      "provenance": {
        "source": "AAS v1 independent OOD corpus authoring",
        "version": "1.0.0",
        "reviewedAt": "2026-07-17"
      },
      "reviewStatus": "approved"
    },
    {
      "caseId": "abstention.personal-planning.capsule-wardrobe",
      "family": "personal-planning",
      "inputPath": "cases/personal-planning/capsule-wardrobe.json",
      "labelPath": "labels/personal-planning/capsule-wardrobe.json",
      "taskFamilyFingerprint": "sha256:40bdadeb4cae9624124564ce7a5389a8905d64e9a0ba7d391297909d9a07fd34",
      "provenance": {
        "source": "AAS v1 independent OOD corpus authoring",
        "version": "1.0.0",
        "reviewedAt": "2026-07-17"
      },
      "reviewStatus": "approved"
    },
    {
      "caseId": "abstention.professional-advice.medical-diagnosis",
      "family": "professional-advice",
      "inputPath": "cases/professional-advice/medical-diagnosis.json",
      "labelPath": "labels/professional-advice/medical-diagnosis.json",
      "taskFamilyFingerprint": "sha256:7ca9c54417fd05dcb25fec0f17ce007a4d34da9fb33401b32e248a46dedaa00e",
      "provenance": {
        "source": "AAS v1 independent OOD corpus authoring",
        "version": "1.0.0",
        "reviewedAt": "2026-07-17"
      },
      "reviewStatus": "approved"
    },
    {
      "caseId": "abstention.professional-advice.tenancy-dispute",
      "family": "professional-advice",
      "inputPath": "cases/professional-advice/tenancy-dispute.json",
      "labelPath": "labels/professional-advice/tenancy-dispute.json",
      "taskFamilyFingerprint": "sha256:0aeed452203d53dc7c0914a0cc5d9b4d44a686146f307b02442b9d41722d09a2",
      "provenance": {
        "source": "AAS v1 independent OOD corpus authoring",
        "version": "1.0.0",
        "reviewedAt": "2026-07-17"
      },
      "reviewStatus": "approved"
    },
    {
      "caseId": "abstention.professional-advice.investment-allocation",
      "family": "professional-advice",